ID;Nom;Sigle;Minitel;Email;Web;Description;Info;Horaires;BP;CP;Telephone1;Telephone2;Fax;CommuneID;CommuneNom;QuarNum;QuarNom;AdreNumero;AdreExtension;AdreImmeuble;AdreRue1;AdreRue2;Longitude;Latitude;OrgaDescription;DomaineLibelle1;DomaineDescription1;DomaineLibelle2;DomaineDescription2;DomaineLibelle3;DomaineDescription3;DomaineLibelle4;DomaineDescription4;Accessibilité 1;Accessibilité 2;Accessibilité 3;Accessibilité 4;Geo
135;Cercle Paul Bert Villejean-Beauregard;CPB;;villejean@cerclepaulbert.asso.fr;www.cerclepaulbert.asso.fr;Association affiliée à la Ligue Française de l'Enseignement.~~~Propose des disciplines très diverses : accompagnement scolaire, accueil de loisirs enfance, accueil de loisirs jeunesse, baby sport, badminton, bokwa, basket-ball, fit’ plein air, football, gym fitness, gymnastique rythmique, ju jitsu brésilien, judo, step, senior’form, stretching, tai chi chuan, tarot, yoga.~~~Loisirs pour les enfants et adolescents : sorties, accueil sur place,  restauration, accueil du mercredi, accueil des petites vacances, accueil des grandes vacances, stages.~~~;;Secrétariat : mardi, 9h à 12h et 16h30 à 18h. Mercredi, 9h à 12h et 14h à 17h30. Jeudi,14h à 18h. Vendredi,9h à 12h et 14h à 17h30. Samedi,9h à 12h30.~~~Accueil de loisirs associatifs pour les 6-11 ans, mercredi, 8h30 à 18h. Lieu : 5 rue d'Armagnac. Contact : 02 99 33 72 51.~~~Accueil de loisirs associatifs pour les 11-17 ans, mercredi et samedi, 14h à 18h, vendredi de 16h30 à 20h. Lieu : 4 bis Square du Berry et/ou 5 rue d’Armagnac. Contact : 02 99 54 10 40 – 02 99 33 72 51. Ouvert été 2016;;35000;02 99 54 10 40;;02 99 33 78 50;1;Rennes;10;Villejean - Beauregard;4;bis;;;SQUARE DU BERRY;-1.709423655;48.11799247;Loisirs pour les enfants et adolescents : sorties, accueil sur place,  restauration, accueil du mercredi, accueil des petites vacances, accueil des grandes vacances, stages.;LOISIRS CULTURELS;;Enfants, adolescents;;Les accueils de loisirs associatifs;;;;Non renseigné;;;;48.11799247, -1.709423655
84;Maison des jeunes et de la culture (MJC) Bréquigny;MJC;;accueil@mjcbrequigny.com;www.mjcbrequigny.com;Propose un large éventail d’ateliers et de pratiques culturelles et artistiques, musique, théâtre, danse, arts plastiques, anglais, feldenkraïs, sophrologie (de 3 mois à l'âge adulte). Anime un pôle multimédia, une ludothèque et propose de l'accompagnement de projets culturels, artistiques et citoyens. Location de salles : café culturel, salle de spectacle, salle associative et de réunion, studio de danse, studio de répétition et d'enregistrement. Accompagnement scolaire : éveil en maternelle et aide à la scolarité du CP au CM2. Centre de loisirs associatif pour les 4 à 12 ans et séjours de vacances. Lieu de concerts et de résidence jazz et musique du monde. Organise en novembre le festival Jazz à l’Ouest.  Tarifs en fonction du quotient familial. Partenaire de la carte Sortir.;;Accueil MJC : lundi, 14h à 20h30. Mardi, 10h à 12h30 et 16h30 à 20h30. Mercredi, 9h à 12h30 et 13h30 à 20h30. Jeudi,  10h à 12h30 et 16h à 20h30. Vendredi, 10h à 12h30 et 14h à 20h15. Samedi,  9h30 à 12h30. ~~~Café culturel : lundi, mardi, jeudi, vendredi, 12h à 14h et samedi, 14h à 18h. ~~~Ludothèque : horaires hors vacances scolaires : mardi, jeudi, vendredi, 16h15 à 18h. Mercredi, 13h30 à 18h. Samedi, 14h à 16h30. Horaires vacances scolaires : mardi, mercredi, jeudi, vendredi,  10h à 12h30 et 13h30 à 18h.~~~Pôle Multimédia : horaires hors vacances scolaires : Mercredi : 16h30 à 19h. Vendredi : 15h à 18h. Horaires vacances scolaires : lundi, mardi, mercredi, jeudi, vendredi, 14h30 à 17h30.~~~Centre de Loisirs : horaires hors vacances scolaires :  mercredi, 8h à 18h30. Horaires vacances scolaires : lundi, mardi, mercredi, jeudi, vendredi : 8h à 18h30.~~~~~~;;35200;02 99 86 95 95;;02 99 86 95 90;1;Rennes;12;Bréquigny;15;;;AVENUE GEORGES GRAFF;AVENUE GEORGES GRAFF;-1.691821726;48.08335074;Centre de loisirs associatifs pour les 4/12 ans le mercredi de 12h à 18h30.;LOISIRS CULTURELS;;Enfants, adolescents;;Les accueils de loisirs associatifs;;;;handicap auditif : bonne accessibilité;handicap cognitif : bonne accessibilité;handicap moteur : bonne accessibilité;handicap visuel : bonne accessibilité;48.08335074, -1.691821726
1050;Ville de Rennes - Direction de l'éducation et de l'enfance;DEE;;dee@ville-rennes.fr;metropole.rennes.fr;Renseignements sur les inscriptions scolaires, restauration, accompagnement scolaire, accueil avant et après la classe, accueils de loisirs municipaux, accueils de loisirs d'été, organisation de dispositifs pédibus.~~~Renseignements et inscriptions accueils périscolaires et de loisirs : 02 23 62 16 74.;;Lundi au vendredi, 8h30 à 12h30 et 13h30 à 17h.;CS 63126;35031;02 23 62 16 78;;02 23 62 16 79;1;Rennes;2;Thabor - Saint-Hélier -  Alphonse Guérin;82;;;;RUE DE PARIS;-1.660498144;48.11370951;;LOISIRS CULTURELS;;Enfants, adolescents;;Les accueils de loisirs d'été;;;;Non renseigné;;;;48.11370951, -1.660498144
1230;Accueil de loisirs Dominique Savio;;;;www.educarennes.fr/index.php/public/default/ecoles?ville=2;Pendant les petites vacances (sauf vacances de Noël), ce centre accueille les enfants du CE1 au CM2. ~~~L'été, le centre accueille les enfants de moyenne section et CP.~~~Un transport en car est possible à partir des centres de départ de quartier. ~~~Les enfants sont encadrés par des responsables éducation et loisirs, des animateurs, des agents spécialisés des écoles maternelles qui proposent un choix d'activités variées : travaux manuels, cuisine, ludothèque, sorties...;;Petites vacances et été.~~~Accueil sur les centres de départ de quartier à partir de 7h30 (7h45 l'été). Départ à 9h, retour vers 18h. Accueil jusqu'à 18h45 (18h30 l'été).;;35000;02 99 63 61 49;;;1;Rennes;5;Maurepas - Bellangerais;;;;;CHEMIN RURAL 34 DE VC 11 AUX CHAMPS RENAUDS;-1.633881282;48.1450958;;LOISIRS CULTURELS;;Enfants, adolescents;;Les accueils de loisirs d'été;;;;Non renseigné;;;;48.1450958, -1.633881282
349;Accueil de loisirs Colombier;;;;http://www.educarennes.fr/index.php/public/default/ecoles?ville=2;Propose un accueil le mercredi après-midi.~~~Pendant les petites vacances, les enfants de petite section au CP y sont accueillis, tandis que les enfants du CE1 au CM2 sont emmenés en car vers les centres de La Prévalaye et de Dominique Savio (centre de départ).~~~L'été, c'est un centre de départ vers Savio et Les Gayeulles.~~~Les enfants sont encadrés par des responsables d'accueil, des animateurs, des agents spécialisés des écoles maternelles.~~~;;Mercredi, 12h15 à 18h45. Petites vacances, sauf vacances de Noël, 7h30 à 18h45~~~Renseignements possibles au 02 23 62 16 50.~~~;;35000;02 99 35 11 57;;;1;Rennes;1;Centre;9;;;;RUE DU DOCTEUR FRANCIS JOLY;-1.682762792;48.10277339;;LOISIRS CULTURELS;;Enfants, adolescents;;Mercredis et petites vacances, les accueils de loisirs municipaux;;;;Non renseigné;;;;48.10277339, -1.682762792
1356;Accueil de loisirs Louise Michel;;;;www.educarennes.fr/index.php/public/default/ecoles?ville=2;Propose un accueil le mercredi après-midi.~~~Pendant les petites vacances, les enfants de petite section et CP y sont accueillis, tandis que les enfants du CE1 au CM2 sont emmenés en car vers les centres de La Prévalaye et de Dominique Savio (centre de départ). ~~~L'été, c'est un centre de départ vers Savio, Les Gayeulles.~~~Les enfants sont encadrés par des responsables éducation et loisirs, des animateurs, des agents spécialisés des écoles maternelles.~~~;;Mercredi, 12h15 à 18h45. Petites vacances, 7h30 à 18h45. L'été, 7h30 à 18h30. ~~~Renseignements possibles au 02 23 62 21 50.~~~;;35000;02 99 31 99 02;;;1;Rennes;1;Centre;7;;;RUE THIERS;RUE THIERS;-1.683497216;48.10628627;;LOISIRS CULTURELS;;Enfants, adolescents;;Mercredis et petites vacances, les accueils de loisirs municipaux;;;;handicap auditif : bonne accessibilité;handicap cognitif : bonne accessibilité;handicap moteur : bonne accessibilité;handicap visuel : bonne accessibilité;48.10628627, -1.683497216
474;Accueil de loisirs Clémenceau;;;;www.educarennes.fr/index.php/public/default/ecoles?ville=2;Propose un accueil le mercredi après-midi.~~~L'été c'est un centre de départ vers La Prévalaye, Les Gayeulles.~~~Les enfants sont encadrés par des responsables éducation et loisirs, des animateurs, des agents spécialisés des écoles maternelles~~~;;Mercredi, 12h15 à 18h45. ~~~Renseignements possibles au 02 23 62 21 50.~~~;;35200;02 99 51 05 74;;;1;Rennes;12;Bréquigny;2;;;;RUE LOUIS ET RENE MOINE;-1.682442131;48.09392767;;LOISIRS CULTURELS;;Enfants, adolescents;;Mercredis et petites vacances, les accueils de loisirs municipaux;;;;Non renseigné;;;;48.09392767, -1.682442131
929;Bibliothèque Maurepas;;;bibliotheque.maurepas@ville-rennes.fr;www.bibliotheques.rennes.fr;A Rennes, 11 bibliothèques de quartier ouvertes à tous vous accueillent pour emprunter livres, magazines, DVD, CD, accéder à internet et lire ou travailler sur place.~~~Partenaire de la carte Sortir.;;Mardi et vendredi, 14h30 à 18h30. Mercredi, 10h à 12h30 et 14h30 à 18h30. Samedi, 10h à 12h30 et 14h30 à 18h.~~~~~~;CS 63126;35031;02 23 62 26 38;;;1;Rennes;5;Maurepas - Bellangerais;32;;;;RUE DE LA MARBAUDAIS;-1.662421612;48.12660362;;LOISIRS CULTURELS;;Tout  public;La plupart des équipements de quartier (municipaux, associatifs) proposent, tout au long de l'année, un grand choix d'activités culturelles, régulières sous forme de stage : loisirs artistiques, audiovisuel, étude et réflexion, musique, science et nature, théâtre…;Bibliothèques municipales;11 bibliothèques ouvertes à tous vous accueillent. Pour emprunter le dernier polar, lire un album à ses enfants, visiter une exposition, choisir un DVD, se renseigner sur la culture des tomates, surfer sur le Net, réviser ses cours, demander un con-seil de lecture, lire le journal et bien d'autres chose encore…;;;handicap auditif : bonne accessibilité;handicap cognitif : faible accessibilité;handicap moteur : faible accessibilité;handicap visuel : accessibilité moyenne;48.12660362, -1.662421612
1446;Bibliothèque Triangle;;;bibliotheque.triangle@ville-rennes.fr;www.bibliotheques.rennes.fr;A Rennes, 11 bibliothèques de quartier ouvertes à tous vous accueillent pour emprunter livres, magazines, DVD, CD, accéder à internet et lire ou travailler sur place. Espace multimédia avec 8 accès internet. Fonds petite enfance et cinéma.~~~Partenaire de la carte Sortir.;Contact pour le secteur jeunesse : 02 23 62 26 95.;Lundi, mardi et vendredi, 14h30 à 18h30. Mercredi, 10h à 12h30 et 14h30 à 18h30. Samedi, 10h à 12h30 et 14h30 à 18h. ~~~;CS 63126;35031;02 23 62 26 93;;;1;Rennes;11;Le Blosne;3;;;;BOULEVARD DE YOUGOSLAVIE;-1.659650685;48.08896908;;LOISIRS CULTURELS;;Tout  public;La plupart des équipements de quartier (municipaux, associatifs) proposent, tout au long de l'année, un grand choix d'activités culturelles, régulières sous forme de stage : loisirs artistiques, audiovisuel, étude et réflexion, musique, science et nature, théâtre…;Bibliothèques municipales;11 bibliothèques ouvertes à tous vous accueillent. Pour emprunter le dernier polar, lire un album à ses enfants, visiter une exposition, choisir un DVD, se renseigner sur la culture des tomates, surfer sur le Net, réviser ses cours, demander un con-seil de lecture, lire le journal et bien d'autres chose encore…;;;Non renseigné;;;;48.08896908, -1.659650685
2282;Médiathèque municipale Vent de culture;;;mediatheque@mairie-brece.fr;www.mairie-brece.fr;Ouverte à tous, la bibliothèque permet l'emprunt de livres, CD et DVD. L'adhésion est de 9€ par famille ou alors de 6€ par adulte (gratuit pour les mineurs et demandeurs d'emploi).;;Mercredi, 10h à 12h30 et 15h à 18h. Vendredi, 15h30 à 18h. Samedi, 10h à 12h30 et  14h à 16h.~~~~~~;;35530;02 99 62 10 31;;;25;Brécé;;;2;;;Rue des 4 Vents;;-1.4840760482;48.1102132991;;LOISIRS CULTURELS;;Tout  public;La plupart des équipements de quartier (municipaux, associatifs) proposent, tout au long de l'année, un grand choix d'activités culturelles, régulières sous forme de stage : loisirs artistiques, audiovisuel, étude et réflexion, musique, science et nature, théâtre…;Bibliothèques municipales;11 bibliothèques ouvertes à tous vous accueillent. Pour emprunter le dernier polar, lire un album à ses enfants, visiter une exposition, choisir un DVD, se renseigner sur la culture des tomates, surfer sur le Net, réviser ses cours, demander un con-seil de lecture, lire le journal et bien d'autres chose encore…;;;Non renseigné;;;;48.1102132991, -1.4840760482
2300;Bibliothèque municipale René de Obaldia;;;bib.chevaigne@laposte.net;www.chevaigne.fr/bibliotheque/pmb/opac_css/index.php;Structure municipale dont la gestion est assurée par l'association Des Livres et vous. Plus de 7000 documents. Axes forts : poésie, petite enfance, partenariat avec la Maison de la poésie de Rennes, avec la Péniche spectacle et avec les écoles. Manifestations organisées : concours enfants, Prix Ados et lecteurs adultes, lectures publiques. Accueil des classes maternelles et primaires, lectures aux tout petits accueillis avec leurs assistantes maternelles. Tarif familial : 8€.~~~;;Lundi, 16h30 à 17h30. Mercredi, 10h30 à 12h et 16h à 18h. Samedi, 10h30 à 12h.~~~;;35250;02 99 55 39 26;;;27;Chevaigné;;;7;;;Rue de la Mairie;;-1.6302484048;48.2120172482;;LOISIRS CULTURELS;;Tout  public;La plupart des équipements de quartier (municipaux, associatifs) proposent, tout au long de l'année, un grand choix d'activités culturelles, régulières sous forme de stage : loisirs artistiques, audiovisuel, étude et réflexion, musique, science et nature, théâtre…;Bibliothèques municipales;11 bibliothèques ouvertes à tous vous accueillent. Pour emprunter le dernier polar, lire un album à ses enfants, visiter une exposition, choisir un DVD, se renseigner sur la culture des tomates, surfer sur le Net, réviser ses cours, demander un con-seil de lecture, lire le journal et bien d'autres chose encore…;;;Non renseigné;;;;48.2120172482, -1.6302484048
2307;Médiathèque Croq'livres;;;mediatheque@nouvoitou.fr;www.nouvoitou.fr;Accès libre et gratuit pour la consultation sur place.;Abonnement famille Nouvoitou : 12€ et extérieurs : 23€.~~~Inscription individuelle gratuite pour les - de 18 ans habitant Nouvoitou et 7€ pour les adultes de Nouvoitou.~~~~~~~~~~~~~~~;Mardi et vendredi, 17h à 18h30. Mercredi, 10h à 12h et 14h à 18h30. Samedi, 10h30 à 12h et 14h à 17h.~~~~~~~~~;;35410;02 99 37 84 71;;;19;Nouvoitou;;;13;;;Rue de Domloup;;-1.5461177250;48.0428305947;;LOISIRS CULTURELS;;Tout  public;La plupart des équipements de quartier (municipaux, associatifs) proposent, tout au long de l'année, un grand choix d'activités culturelles, régulières sous forme de stage : loisirs artistiques, audiovisuel, étude et réflexion, musique, science et nature, théâtre…;Bibliothèques municipales;11 bibliothèques ouvertes à tous vous accueillent. Pour emprunter le dernier polar, lire un album à ses enfants, visiter une exposition, choisir un DVD, se renseigner sur la culture des tomates, surfer sur le Net, réviser ses cours, demander un con-seil de lecture, lire le journal et bien d'autres chose encore…;;;handicap auditif : bonne accessibilité;handicap cognitif : bonne accessibilité;handicap moteur : faible accessibilité;handicap visuel : accessibilité moyenne;48.0428305947, -1.546117725
2310;Médiathèque de Pacé;;;contact@mediatheque-pace.fr;www.mediatheque-pace.fr;. Marmothèque (lecture et éveil musical pour les tout-petits) ~~~. accueil des classes (rencontres avec auteurs et illustrateurs), spectacles. ~~~. Amis de la lecture (lecture plaisir, pour les enfants du primaire) ~~~. Prix Ados (prix littéraire décerné par les adolescents, qui rencontrent chaque année un auteur) ~~~. animations thématiques~~~. projections de films~~~. ateliers de l'Espace Multimédia (initiations et découverte de services Internet et de logiciels libres et / ou gratuits).~~~Accès, recherche documentaire informatisée et consultation sur place des documents : libre et ouvert à tous.~~~Abonnement gratuit jusqu'à 18 ans.~~~12€ pour un adulte pacéen (22€ pour un adulte non pacéen)  pour 10 documents (livres, revues, CD, DVD) pour 3 semaines (abonnement gratuit pour les pacéens âgés de 18 à 25 ans).~~~;;Mardi et vendredi,  15h à 19h. Mercredi,  10h à 12h30 et 14h à 18h30. Jeudi, 15h à 18h30. Samedi, 10h à 12h30 et de 14h à 17h.~~~;;35740;02 99 85 51 10;;;8;Pacé;;;;;;Chemin de la Métairie;;-1.7731809577;48.1468038836;;LOISIRS CULTURELS;;Tout  public;La plupart des équipements de quartier (municipaux, associatifs) proposent, tout au long de l'année, un grand choix d'activités culturelles, régulières sous forme de stage : loisirs artistiques, audiovisuel, étude et réflexion, musique, science et nature, théâtre…;Bibliothèques municipales;11 bibliothèques ouvertes à tous vous accueillent. Pour emprunter le dernier polar, lire un album à ses enfants, visiter une exposition, choisir un DVD, se renseigner sur la culture des tomates, surfer sur le Net, réviser ses cours, demander un con-seil de lecture, lire le journal et bien d'autres chose encore…;;;Non renseigné;;;;48.1468038836, -1.7731809577
2812;Bibliothèque municipale de Romillé;;;bibliotheque@romille.fr;www.romille.fr;Livres, revues et CD. Un poste internet public. Cotisation : 5€.;Bâtiment L'encrier.~~~;Mardi, 16h30 à 18h. Mercredi, 10h30 à 12h30 et 15h à 18h30. Vendredi, 16h à 18h. Samedi, 10h30 à 12h. Dimanche, 10h30 à 11h45.~~~;;35850;02 99 23 25 43;;;50;Romillé;;;9;;;Rue des Trois Evêchés;;-1.8897846185;48.2161315282;;LOISIRS CULTURELS;;Tout  public;La plupart des équipements de quartier (municipaux, associatifs) proposent, tout au long de l'année, un grand choix d'activités culturelles, régulières sous forme de stage : loisirs artistiques, audiovisuel, étude et réflexion, musique, science et nature, théâtre…;Bibliothèques municipales;11 bibliothèques ouvertes à tous vous accueillent. Pour emprunter le dernier polar, lire un album à ses enfants, visiter une exposition, choisir un DVD, se renseigner sur la culture des tomates, surfer sur le Net, réviser ses cours, demander un con-seil de lecture, lire le journal et bien d'autres chose encore…;;;Non renseigné;;;;48.2161315282, -1.8897846185
2314;Bibliothèque municipale Le Chat'pitre;;;accueil.mairie@saint-armel-35.fr;saint-armel-35.fr;Emprunt de livres, périodiques et CD audio. Adhésion : 4€/an/famille.;;Mercredi, 15h à 17h. Jeudi, 15h30 à 17h. Samedi, 10h30 à 12h.;;35230;02 99 62 93 88;;;16;Saint-Armel;;;14;;;Rue de la Mairie;;-1.5935751205;48.0142979833;;LOISIRS CULTURELS;;Tout  public;La plupart des équipements de quartier (municipaux, associatifs) proposent, tout au long de l'année, un grand choix d'activités culturelles, régulières sous forme de stage : loisirs artistiques, audiovisuel, étude et réflexion, musique, science et nature, théâtre…;Bibliothèques municipales;11 bibliothèques ouvertes à tous vous accueillent. Pour emprunter le dernier polar, lire un album à ses enfants, visiter une exposition, choisir un DVD, se renseigner sur la culture des tomates, surfer sur le Net, réviser ses cours, demander un con-seil de lecture, lire le journal et bien d'autres chose encore…;;;Non renseigné;;;;48.0142979833, -1.5935751205
2321;Médiathèque de Vern-sur-Seiche;;;mediatheque@ville-vern-sur-seiche.fr;mediatheque-vern-sur-seiche.opac3d.fr;Située dans l'espace culturel Le Volume, la médiathèque est composée de différents espaces : jeunesse, adultes, musique–cinéma, multimédia. Animations pour tous les âges : contes pour enfants, initiation à l'informatique...~~~Emprunt de livres, revues et magazines, CD, DVD et cassettes vidéo, livres audio.~~~Inscription : 12 ,50€/adulte/an, 3,50€ pour les étudiants de moins de 25 ans (gratuit pour les moins de 18 ans et bénéficiaires des minima sociaux). Gratuit carte sortir.~~~;;Mardi, 15h à 18h. Mercredi, 10h à 12h30 et 13h30 à 18h. Vendredi, 15h à 18h30. Samedi, 10h à 12h30 et 13h30 à 16h.~~~;BP 77103;35770;02 99 62 86 96;;02 99 62 12 17;2;Vern-sur-Seiche;;;;;;Avenue de la Chalotais;;-1.6020190761;48.0439297319;;LOISIRS CULTURELS;;Tout  public;La plupart des équipements de quartier (municipaux, associatifs) proposent, tout au long de l'année, un grand choix d'activités culturelles, régulières sous forme de stage : loisirs artistiques, audiovisuel, étude et réflexion, musique, science et nature, théâtre…;Bibliothèques municipales;11 bibliothèques ouvertes à tous vous accueillent. Pour emprunter le dernier polar, lire un album à ses enfants, visiter une exposition, choisir un DVD, se renseigner sur la culture des tomates, surfer sur le Net, réviser ses cours, demander un con-seil de lecture, lire le journal et bien d'autres chose encore…;;;Non renseigné;;;;48.0439297319, -1.6020190761
909;Maison de la consommation et de l'environnement (MCE);MCE;;info@mce-info.org;www.mce-info.org;Regroupe 23 associations d'environnement et de défense des consommateurs qui conseillent et aident le public dans le règlement des litiges de consommation (logement, crédit, banque, etc) ou de l'environnement. Oriente vers les permanences des associations-membres. ~~~Centre de documentation sur la consommation (réglementation, tests comparatifs, toutes revues consuméristes...) et sur l'environnement et la nutrition. Edite des documents d'informations pratiques sur les questions de la vie quotidienne (colocation, santé-environnement...).~~~Les associations-membres :~~~. Association conseil, défense des consommateurs et du logement (ACDCL)~~~. Association force ouvrière consommateur (AFOC)~~~. Association Gulliver (Groupement des utilisateurs de logiciels et oeuvres libres d'Ille-et-Vilaine et des environs de Rennes)~~~. Association Léo Lagrange pour la défense des consommateurs (ALLDC)~~~. Confédération générale du logement et de la consommation (CGLC 35)~~~. Confédération nationale du logement, de la consommation et de l'environnement (CNL 35)~~~. Confédération syndicale des familles (CSF 35)~~~. Consommation, logement et cadre de vie (CLCV)~~~.Familles rurales ~~~. Information défense du consommateur salarié CGT (Indecosa CGT)~~~. Union départementale des associations familiales d'Ille-et-Vilaine (UDAF 35)~~~. Bretagne vivante/Société pour l'étude et la protection de la nature en Bretagne (SEPNB)~~~. Eau et rivières de Bretagne (ERB)~~~. Empreinte~~~. Espace Piéton~~~. Fédération Ille-et-Vilaine nature environnement (Ivine)~~~. Greenpeace~~~. Groupe d'étude des invertébrés armoricains (Grétia)~~~. Ligue pour la protection des oiseaux (LPO 35)~~~. Rayons d'action~~~. Société d'horticulture d'Ille-et-Vilaine~~~. Sortir du nucléaire pays de Rennes~~~. Vert le jardin.~~~~~~;;Lundi au jeudi, 9h à 12h30 et 14h à 18h. Vendredi, 9h à 17h.~~~Centre de documentation : Lundi 14h à 18h. Du mardi au jeudi 9h à 12h30 et 14h à 18h. Vendredi 9h à 17h.~~~;;35000;02 99 30 35 50;;;1;Rennes;1;Centre;48;;;Boulevard Magenta;;-1.673896275;48.10466509;Centre de documentation sur la consommation (réglementation, tests comparatifs, toutes revues consuméristes...) et sur l'environnement et la nutrition. Edite des documents d'informations pratiques sur les questions de la vie quotidienne (colocation...).;LOISIRS CULTURELS;;Tout  public;La plupart des équipements de quartier (municipaux, associatifs) proposent, tout au long de l'année, un grand choix d'activités culturelles, régulières sous forme de stage : loisirs artistiques, audiovisuel, étude et réflexion, musique, science et nature, théâtre…;Bibliothèques spécialisées et autres;;;;Non renseigné;;;;48.10466509, -1.673896275
746;Société archéologique et historique d'Ille-et-Vilaine;SAHIV;;danielannie.pichot@numericable.fr;www.sahiv.fr;Conférences et débats sur l'histoire de Rennes, de l'Ille-et-Vilaine et de la Bretagne. Sorties-découvertes en Ille-et-Vilaine et dans les départements limitrophes. Publie chaque année, en juin, un bulletin sur l'histoire du département et de la Bretagne, distribué aux adhérents et disponible dans le commerce.;;2e mardi de chaque mois, d'octobre à juin, 14h30 à 16h45, au Musée de Bretagne.;;35000;02 99 50 87 77;;;1;Rennes;10;Villejean - Beauregard;1;;;;RUE JACQUES LEONARD;-1.693432072;48.1285963;;LOISIRS CULTURELS;;Tout  public;La plupart des équipements de quartier (municipaux, associatifs) proposent, tout au long de l'année, un grand choix d'activités culturelles, régulières sous forme de stage : loisirs artistiques, audiovisuel, étude et réflexion, musique, science et nature, théâtre…;Les archives;;;;Non renseigné;;;;48.1285963, -1.693432072
