ID;Nom;Sigle;Minitel;Email;Web;Description;Info;Horaires;BP;CP;Telephone1;Telephone2;Fax;CommuneID;CommuneNom;QuarNum;QuarNom;AdreNumero;AdreExtension;AdreImmeuble;AdreRue1;AdreRue2;Longitude;Latitude;OrgaDescription;DomaineLibelle1;DomaineDescription1;DomaineLibelle2;DomaineDescription2;DomaineLibelle3;DomaineDescription3;DomaineLibelle4;DomaineDescription4;Accessibilité 1;Accessibilité 2;Accessibilité 3;Accessibilité 4;Geo
1151;Ferme des Basses Gayeulles;;;dj-eq08-ferme-pour-enfants@ville-rennes.fr;;Ferme pédagogique accueillant les enfants pour des activités centrées sur les animaux, le jardin et les travaux de la ferme.;;Centre de loisirs mercredi après-midi, samedi après-midi et pendant les vacances scolaires du lundi au vendredi, à la demi-journée ou à la journée.~~~Accueil de groupes d'enfants (classe, crèches...) en période scolaire, sur rendez-vous.~~~Réservée aux familles pour des visites libres, en période scolaire, les mardis, jeudis et vendredis, 16h30 à 18h, de septembre à octobre et de février à juin.~~~Fermée du 4 janvier au 9 juillet 2017.;;35700;02 99 36 71 73;;;1;Rennes;5;Maurepas - Bellangerais;;;;;RUE DU PROFESSEUR MAURICE AUDIN;-1.648822903;48.13440829;Centre de loisirs mercredi, samedi après-midi et pendant les vacances scolaires du lundi au vendredi, à la demi-journée ou à la journée.;LOISIRS CULTURELS;;Enfants, adolescents;;Centres d'animation nature-environnement (Ville de Rennes);;;;Non renseigné;;;;48.13440829, -1.648822903
314;Maison de quartier La Touche;;;contact@mdqlatouche.com;www.mdqlatouche.com;Equipement de quartier (accueil de loisirs et pôle petite enfance) et ludothèque.;Centre de loisirs associatifs pour les 4-12 ans, mercredi, 13h30 à 18h30.~~~Accueil jeunes 11-18 ans  tout le mois de juillet du lundi au vendredi, 13h30 à 18h30 et activités à la journée le vendredi.;Mardi au vendredi, 9h à 12h et 14h à 19h (secrétariat). Samedi, 14h à 18h (ludothèque et accueil jeunesse). Ouvert été 2016.;;35000;02 99 54 45 12;;;1;Rennes;3;Bourg-L'Evêque - La Touche - Moulin du Comte;6;;;RUE CARDINAL PAUL GOUYON;RUE CARDINAL PAUL GOUYON;-1.689014615;48.11726849;Centre de loisirs associatifs pour les 4-12 ans, mercredi, 13h30 à 18h30.;LOISIRS CULTURELS;;Enfants, adolescents;;Les accueils de loisirs associatifs;;;;handicap auditif : bonne accessibilité;handicap cognitif : bonne accessibilité;handicap moteur : bonne accessibilité;handicap visuel : bonne accessibilité;48.11726849, -1.689014615
225;Cercle Paul Bert Nord-Ouest;CPB;;noroit@cerclepaulbert.asso.fr;www.cerclepaulbert.asso.fr;Equipement de quartier : activités sportives et culturelles.~~~Football, handball, sports de la forme, accueil de loisirs.~~~;Accompagnement scolaire individualisé et collectif du CP au CM2. Accueil de loisirs.;Secrétariat transféré au Noroît, 28 rue Charles Géniaux.~~~;;35000;02 99 54 27 27;02 23 46 10 40;02 99 54 53 79;1;Rennes;3;Bourg-L'Evêque - La Touche - Moulin du Comte;30;;;Rue Charles Géniaux;;-1.710684653;48.1108377;Centre de loisirs associatifs pour les 5-11ans le mercredi, 8h30 à 18h30. Lieu : 15, rue Renée Prévert.Contact : 02 23 46 10 40.;LOISIRS CULTURELS;;Enfants, adolescents;;Les accueils de loisirs associatifs;;;;Non renseigné;;;;48.1108377, -1.710684653
2371;Groupe rennais de pédagogie et d’animation sociale;GRPAS;;grpas@free.fr;www.gpas.infini.fr;Propose  aux enfants de 6 à 12 ans, habitant Maurepas et scolarisés à l’école Trégain, des activités par petits groupes (2 à 4 enfants). Ces activités de découverte de la Ville de Rennes ont vocation à faire découvrir à l’enfant de nouvelles activités (culturelles, économiques, sportives, environnementales, ...) et de l’éduquer à la mobilité (déplacement en transport en commun, à pied ou à vélo).;Centre de loisirs associatifs pour les 6-12ans mercredi, 12h à 19h.;Les horaires sont fonction des activités proposées.;;35700;09 54 17 15 68;;;1;Rennes;5;Maurepas - Bellangerais;32;;;;RUE DE LA MARBAUDAIS;-1.662556515;48.1265965;;LOISIRS CULTURELS;;Enfants, adolescents;;Les accueils de loisirs associatifs;;;;Non renseigné;;;;48.1265965, -1.662556515
853;Centre socioculturel des Longs Prés;;;centreleslongspres@gmail.com;www.leslongspres.fr;Structure associative proposant des activités culturelles, physiques et sportives.;Centre de loisirs associatifs pour les 6-11 ans, mercredi, 12h à 18h30.;Lundi au vendredi, 9h à 12h30 et  13h30 à 18h30. Samedi, 9h à 12h. Pendant les vacances scolaires : lundi au vendredi, 14h à 18h.~~~Centre de loisirs associatifs pour les 6-11 ans, mercredi,  12h à 18h30.;;35700;02 99 38 43 86;;;1;Rennes;5;Maurepas - Bellangerais;3;;;RUE DES LONGS PRES;RUE DES LONGS PRES;-1.655997186;48.13261193;Centre de loisirs associatifs pour les 6-11 ans le mercredi de 12h à 18h30.;LOISIRS CULTURELS;;Enfants, adolescents;;Les accueils de loisirs associatifs;;;;handicap auditif : bonne accessibilité;handicap cognitif : bonne accessibilité;handicap moteur : bonne accessibilité;handicap visuel : bonne accessibilité;48.13261193, -1.655997186
1093;Le Grand Cordel - Maison des jeunes et de la culture (MJC);MJC;;contact@grand-cordel.com;www.grand-cordel.com;Equipement de quartier à vocation culturelle et artistique.~~~Propose des ateliers d'arts plastiques, de danse, de musique, de théâtre, de bien-être, de cirque, de vidéo, d’informatique et de fabrication numérique... Son projet se situe prioritairement dans le domaine des arts visuels, autour de la diffusion de l'art contemporain.~~~ ~~~;;Lundi, mardi, mercredi, jeudi et vendredi, 14h à 20h30. Samedi, 9h à 13h. Sous réserve de modifications.~~~Pendant les vacances scolaires : lundi au vendredi, 9h à 12h et 14h à 17h30. Fermée à Noël et en août.~~~Centre de loisirs (L'abripuces) associatifs pour les 3-11 ans, mercredi, 8h30 à 18h30.~~~Centre de loisirs associatifs pendant les vacances scolaires pour les 3-11 ans, lundi au vendredi, 9h à 12h30 et 14h à 17h30.~~~Ouvert été 2016;;35700;02 99 87 49 49;;02 99 87 49 41;1;Rennes;6;Jeanne d'Arc - Longs Champs - Beaulieu;18;;;RUE DES PLANTES;RUE DES PLANTES;-1.648014044;48.12192026;Centre de loisirs associatifs pour les 6-11 ans le mercredi, 12h à 18h30.;LOISIRS CULTURELS;;Enfants, adolescents;;Les accueils de loisirs associatifs;;;;handicap auditif : bonne accessibilité;handicap cognitif : faible accessibilité;handicap moteur : bonne accessibilité;handicap visuel : bonne accessibilité;48.12192026, -1.648014044
1303;Maison verte;;;maisonverte2003@yahoo.fr;;Maison de jeunes et équipement de proximité. De nombreuses activités culturelles, sportives, ludiques sont proposées pour les jeunes de 10 à 18 ans sur place, en sorties,ainsi que des séjours à l'extérieur. Accompagnement de projets. Soutien aux initiatives individelles ou collectives. ~~~Permanence pour les jeunes adultes avec une écoute individualisée afin de les aider à effectuer leurs démarches administratives, de recherche d'emploi ou à résoudre toute autre situation les préoccupant.~~~Un jardin bio composé d'un potager et d'un poulailler vient en complément dans les activités éco-citoyennes réalisées avec les jeunes au sein de l'équipement~~~Un terrain synthétique mitoyen de l'équipement permet la pratique du football, du volley et de la pétanque.~~~;;En période scolaire, accueil des jeunes mineurs scolarisés : mardi et jeudi et vendredi, 16h à 19h. Mercredi, 14h à 19h. Samedi, 14h à 18h. Pendant les vacances scolaires, accueil tout public. Priorité pour les mineurs avec propositions d’activités au quotidien du lundi au vendredi, 14h à 19h et 20h à 22h.~~~;;35000;02 99 33 11 33;;02 99 33 16 74;1;Rennes;10;Villejean - Beauregard;5;;;RUE DE SAINTONGE;RUE DE SAINTONGE;-1.718277944;48.12232915;De nombreuses activités sportives (dont football en district junior) et culturelles sont proposées pour les jeunes (à partir de 10 ans) et les jeunes adultes : sur place, en sorties, lors de mini-camps, etc.;LOISIRS CULTURELS;;Enfants, adolescents;;Les accueils de loisirs associatifs;;;;Non renseigné;;;;48.12232915, -1.718277944
418;Centre social Carrefour 18;CS;;c18@assoarcs.com;www.centres-sociaux-rennais.fr;Equipement de proximité à la disposition des habitants : accueil, information sociale, aide à la fonction parentale et à la vie quotidienne. Favorise le lien social et la solidarité entre les habitants à travers des animations spécifiques, et le soutien aux initiatives des habitants et associations visant à une vie de quartier plus conviviale.~~~Partenaire de la carte Sortir.;Groupe Parlons français : compréhension et expression orales basées sur la vie quotidienne. Ateliers Ordilangue : apprentissage du Français oral et écrit avec l'ordinateur. Permanence juridique gratuite assurée par des avocats du Tribunal de grande instance pour les personnes d'origine étrangère. Accompagnement scolaire individuel du CP à la 3e. Accueil de loisirs mercredi et vacances scolaires, pour les enfants de 3 à 11 ans.  Halte-garderie pour les enfants de 3 mois à 3 ans. Espaces parents/enfants. Ateliers socioculturels (écriture, dessin, peinture, chorale, arts créatifs, travaux d’aiguilles, randonnées, anglais…). Sorties d’été, expositions, animations conviviales, spectacles, visites…~~~Dispose également d'un espace ressources emploi(ERE).Il reçoit tous les habitants inscrits ou non au Pôle emploi en recherche d'un emploi ou d'une formation.Il propose  un premier niveau d'information et de documentation, en orientant les personnes vers les interlocuteurs ressources.;Lundi, mercredi et vendredi, 9h à 18h. Mardi, 13h45 à 18h. Jeudi, 9h à 12h15 et 13h45 à 18h. Pendant les vacances scolaires : fermé le midi. Accueil de loisirs mercredi après-midi et vacances scolaires, pour les enfants de 3 à 11 ans.;;35200;02 99 51 32 25;;02 99 50 86 52;1;Rennes;11;Le Blosne;7;;;;RUE D'ESPAGNE;-1.672416964;48.08716104;Accueil de loisirs mercredi et vacances scolaires, pour les enfants de 3 à 11 ans.;LOISIRS CULTURELS;;Enfants, adolescents;;Les accueils de loisirs associatifs;;;;handicap auditif : bonne accessibilité;handicap cognitif : faible accessibilité;handicap moteur : faible accessibilité;handicap visuel : faible accessibilité;48.08716104, -1.672416964
1336;Maison des jeunes et de la culture (MJC) - Maison de Suède;MJC;;mjcmaisondesuede@gmail.com;www.mjcmaisondesuede.fr;Propose des activités culturelles et sportives. Pôle multimédia avec formations internet et découverte de l'ordinateur tous les mardis et jeudis. Activités diverses pour les adolescents de 10 à 17 ans tous les jours et durant les vacances scolaires.~~~~~~;Accueil pour les enfants de 0 à 3 ans avec les parents ou assistante maternelle lundi, mardi et jeudi, 10h à 12h.~~~Accompagnement scolaire collectif du CP à la terminale.~~~Centre de loisirs associatifs pour les 6-9 ans, mercredi, 13h30 à 17h45.;En période scolaire : lundi, 10h à 12h et 14h à 19h. Mardi et vendredi, 10h à 12h et 14h à 19h. Mercredi, 10h à 12h et 14h à 18h. Jeudi, 14h à 19h. Samedi, 14h à 18h.~~~Pendant les vacances scolaires : lundi au vendredi, 10h à 12h et 14h à 18h. Ouvert été 2016;;35200;02 99 51 61 70;;02 23 30 87 00;1;Rennes;12;Bréquigny;5;;;;RUE DE SUEDE;-1.677664215;48.08705049;Centre de loisirs associatifs pour les 6-9 ans, mercredi, 13h30 à 17h45.;LOISIRS CULTURELS;;Enfants, adolescents;;Les accueils de loisirs associatifs;;;;handicap auditif : bonne accessibilité;handicap cognitif : faible accessibilité;handicap moteur : faible accessibilité;handicap visuel : faible accessibilité;48.08705049, -1.677664215
1467;Halte-garderie Primevères;;;haltegarderie.primeveres@yahoo.fr;halte-garderie-primeveres.org;Unique halte-garderie du département adaptée pour l'accueil des enfants de 1 à 6 ans, présentant un handicap.~~~L’équipe éducative, constituée de salariés spécialisés et de bénévoles, accompagne chaque enfant individuellement dans ses activités.~~~;;En période scolaire : accueil des enfants du lundi au vendredi, 13h30 à 17h. Fermée pendant les vacances scolaires.;;35230;02 99 50 72 64;;;6;Noyal-Châtillon-sur-Seiche;;;19;;;Rue du Hil;;-1.6716234035;48.0767615018;;LOISIRS CULTURELS;;Enfants, adolescents;;Les centres d'accueil pour enfants handicapés;;;;Non renseigné;;;;48.0767615018, -1.6716234035
1265;Accueil de loisirs Saint-Malo/Contour Saint-Aubin;;;;www.educarennes.fr/index.php/public/default/ecoles?ville=2;Ce centre propose un accueil le mercredi après-midi.~~~Les enfants sont encadrés par des responsables éducation et loisirs, des animateurs, des agents spécialisés des écoles maternelles.;~~~~~~;Mercredi, 12h15 à 18h45.~~~Renseignements possibles au 02 23 62 16 53.~~~;;35000;02 99 38 44 00;;;1;Rennes;1;Centre;7;;;;RUE DE SAINT-MALO;-1.681423502;48.11620281;;LOISIRS CULTURELS;;Enfants, adolescents;;Mercredis et petites vacances, les accueils de loisirs municipaux;;;;handicap auditif : bonne accessibilité;handicap cognitif : bonne accessibilité;handicap moteur : bonne accessibilité;handicap visuel : bonne accessibilité;48.11620281, -1.681423502
429;Accueil de loisirs Faux Pont/Liberté;;;;www.educarennes.fr/index.php/public/default/ecoles?ville=2;Propose un accueil le mercredi après-midi.~~~Les enfants sont encadrés par des responsables éducation et loisirs, des animateurs, des agents spécialisés des écoles maternelles.;Faux Pont : 02 99 31 54 60 ~~~Liberté: 02 99 30 89 64;Mercredi, 12h15 à 18h45.~~~Renseignements possibles au 02 23 62 21 50.;;35000;02 99 31 54 60;02 99 30 89 64;;1;Rennes;2;Thabor - Saint-Hélier -  Alphonse Guérin;4;;;Ruelle du Faux pont;;-1.6726811832;48.1072981144;;LOISIRS CULTURELS;;Enfants, adolescents;;Mercredis et petites vacances, les accueils de loisirs municipaux;;;;Non renseigné;;;;48.1072981144, -1.6726811832
460;Accueil de loisirs Carle Bahon;;;;www.educarennes.fr/index.php/public/default/ecoles?ville=2;Propose un accueil le mercredi après-midi.~~~L'été, c'est un centre de départ vers les centres de la Prévalaye et Des Gayeulles.~~~Les enfants sont encadrés par des responsables éducation et loisirs, des animateurs, des agents spécialisés des écoles maternelles.;Dispose de boucle magnétique pour les personnes malentendantes.;Mercredi, 12h15 à 18h45. ~~~Renseignements possibles au 02 23 62 15 92.~~~;;35200;02 99 50 77 88;;;1;Rennes;7;Francisco-Ferrer - Landry - Poterie;7;;;RUE FRANCISCO FERRER;RUE FRANCISCO FERRER;-1.654848542;48.09642082;;LOISIRS CULTURELS;;Enfants, adolescents;;Mercredis et petites vacances, les accueils de loisirs municipaux;;;;handicap auditif : bonne accessibilité;handicap cognitif : bonne accessibilité;handicap moteur : bonne accessibilité;handicap visuel : bonne accessibilité;48.09642082, -1.654848542
3000;Accueil de loisirs Robert Doisneau;;;;http://www.educarennes.fr/index.php/public/default/ecoles?ville=2;Propose un accueil le mercredi après-midi.~~~Pendant les petites vacances, les enfants de petite section et CP y sont accueillis, tandis que les enfants du CE1 au CM2 sont emmenés en car vers les centres de La Prévalaye (centre de départ) et de Dominique Savio.~~~L'été, il accueille les petites sections. C'est aussi un centre de départ vers La Prévalaye, Les Gayeulles.~~~Les enfants sont encadrés par des responsables éducation et loisirs, des animateurs, des agents spécialisés des écoles maternelles.~~~;;Mercredi, 12h15 à 18h45. Petites vacances, 7h30 à 18h45. L'été du lundi au vendredi, 7h45 à 18h30. ~~~Renseignements possibles au 02 23 62 15 92.~~~;;35000;;;;1;Rennes;7;Francisco-Ferrer - Landry - Poterie;6;;;Rue René-Yves Creston;;-1.6413029202;48.0901516763;;LOISIRS CULTURELS;;Enfants, adolescents;;Mercredis et petites vacances, les accueils de loisirs municipaux;;;;Non renseigné;;;;48.0901516763, -1.6413029202
1216;Accueil de loisirs La Prévalaye;;;;www.educarennes.fr/index.php/public/default/ecoles?ville=2;Pendant les petites vacances (sauf vacances de Noël),  accueille les enfants du CE1 au CM2. ~~~L'été, accueille les enfants de moyenne section et CP.~~~Un transport en car est possible à partir des centres de départ de quartier. ~~~Les enfants sont encadrés par des responsables éducation et loisirs, des animateurs, des agents spécialisés des écoles maternelles qui proposent un choix d'activités variées : travaux manuels, cuisine, ludothèque, sorties... ~~~~~~;;Petites vacances, et été.~~~Accueil sur les centres de départ de quartier à partir de 7h30 (7h45 l'été). Départ à 9h, retour vers 18h. Accueil jusqu'à 18h45 (18h30 l'été).~~~;;35000;02 99 31 06 25;;;1;Rennes;9;Cleunay - Arsenal - Redon - La Courrouze;;;;;CHEMIN ROBERT DE BORON;-1.727026609;48.09541071;;LOISIRS CULTURELS;;Enfants, adolescents;;Mercredis et petites vacances, les accueils de loisirs municipaux;;;;Non renseigné;;;;48.09541071, -1.727026609
1071;Accueil de loisirs Andrée Chédid;;;;www.educarennes.fr/index.php/public/default/ecoles?ville=2;Propose un accueil le mercredi après-midi.~~~Pendant les petites vacances, les enfants de petite section au CP y sont accueillis, tandis que les enfants du CE1 au CM2 sont emmenés en car vers les centres de La Prévalaye et de Dominique Savio (centre de départ). L’été, les enfants de petite section y sont accueillis. C'est aussi un centre de départ vers Dominique Savio, Les Gayeulles.~~~Les enfants sont encadrés par des responsables éducation et loisirs, des animateurs, des agents spécialisés des écoles maternelles.~~~;;Mercredi, 12h15 à 18h45. Petites vacances, 7h30 à 18h45. L'été du lundi au vendredi, 7h45 à 18h30.~~~Renseignements possibles au 02 23 62 16 53. ~~~;;35000;02 99 59 77 71;;;1;Rennes;10;Villejean - Beauregard;9;;;;RUE DE PICARDIE;-1.711413157;48.12285024;;LOISIRS CULTURELS;;Enfants, adolescents;;Mercredis et petites vacances, les accueils de loisirs municipaux;;;;Non renseigné;;;;48.12285024, -1.711413157
3013;Accueil de loisirs Nelson Mandela;;;;;Accueil de loisirs le mercredi après-midi.;;De 12h15 à 18h45;;35000;;;;1;Rennes;10;Villejean - Beauregard;1;;;Rue Christine de Pisan;;-1.6984939351;48.1339832006;;LOISIRS CULTURELS;;Enfants, adolescents;;Mercredis et petites vacances, les accueils de loisirs municipaux;;;;;;;;48.1339832006, -1.6984939351
819;Accueil de loisirs Léon Grimault;;;;www.educarennes.fr/index.php/public/default/ecoles?ville=2;Propose un accueil le mercredi après-midi.~~~Les enfants sont encadrés par des responsables éducation et loisirs, des animateurs, des agents spécialisés des écoles maternelles.~~~~~~;;Mercredi, 12h15 à 18h45.~~~Renseignements possibles au 02 23 62 15 92.~~~;;35200;02 99 51 44 16;;;1;Rennes;11;Le Blosne;20;;;;BOULEVARD LEON GRIMAULT;-1.648580571;48.09076401;;LOISIRS CULTURELS;;Enfants, adolescents;;Mercredis et petites vacances, les accueils de loisirs municipaux;;;;Non renseigné;;;;48.09076401, -1.648580571
1106;Accueil de loisirs Pascal Lafaye;;;;www.educarennes.fr/index.php/public/default/ecoles?ville=2;Ce centre propose un accueil le mercredi après-midi.~~~Pendant les petites vacances, les enfants de petite section et CP y sont accueillis, tandis que les enfants du CE1 au CM2 sont emmenés en car vers les centres de La Prévalaye (centre de départ) et de Dominique Savio. L'été, c'est un centre de départ vers les centres La Prévalaye, et des Gayeulles  .~~~Les enfants sont encadrés par des responsables éducation et loisirs, des animateurs, des agents spécialisés des écoles maternelles.~~~;;Mercredi, 12h15 à 18h45. Petites vacances, 7h30 à 18h45. ~~~Renseignements possibles au 02 23 62 15 92.~~~;;35200;02 99 53 14 33;;;1;Rennes;11;Le Blosne;13;;;BOULEVARD DU PORTUGAL;BOULEVARD DU PORTUGAL;-1.670490663;48.08395546;;LOISIRS CULTURELS;;Enfants, adolescents;;Mercredis et petites vacances, les accueils de loisirs municipaux;;;;handicap auditif : bonne accessibilité;handicap cognitif : bonne accessibilité;handicap moteur : bonne accessibilité;handicap visuel : bonne accessibilité;48.08395546, -1.670490663
1437;Accueil de loisirs Volga;;;;www.educarennes.fr/index.php/public/default/ecoles?ville=2;Propose un accueil le mercredi après-midi.~~~Pendant les petites vacances, les enfants de petite section et CP y sont accueillis, tandis que les enfants du CE1 au CM2 sont emmenés en car vers La Prévalaye et  Dominique Savio. L’été, c’est un centre de départ vers La Prévalaye, Les Gayeulles.~~~Les enfants sont encadrés par des responsables éducation et loisirs, des animateurs, des agents spécialisés des écoles maternelles.;;Mercredi, 12h15 à 18h45. Petites vacances, 7h30 à 18h45. L'été, 7h45 à 18h30. ~~~Renseignements possibles au 02 23 62 15 92.;;35200;02 99 51 12 80;;;1;Rennes;11;Le Blosne;3;;;;RUE DE LA VOLGA;-1.653105999;48.08540094;;LOISIRS CULTURELS;;Enfants, adolescents;;Mercredis et petites vacances, les accueils de loisirs municipaux;;;;Non renseigné;;;;48.08540094, -1.653105999
22;Accueil de loisirs Jacques Prévert;;;;www.educarennes.fr/index.php/public/default/ecoles?ville=2;Propose un accueil le mercredi après-midi.~~~Pendant les petites vacances, les enfants de petite section et CP y sont accueillis, tandis que les enfants du CE1 au CM2 sont emmenés en car vers La Prévalaye (centre de départ) et Dominique Savio. ~~~L’été, il accueille les petites sections. Il est aussi un centre de départ vers La Prévalaye et les Gayeulles.~~~Les enfants sont encadrés par des responsables éducation et loisirs, des animateurs, des agents spécialisés des écoles maternelles.~~~;;Mercredi, 12h15 à 18h45. Petites vacances, 7h30 à 18h45. L'été du lundi au vendredi, 7h45 à 18h30. ~~~Renseignements possibles au 02 23 62 21 50.~~~;;35200;02 99 51 05 00;;;1;Rennes;12;Bréquigny;40;;;;BOULEVARD ALBERT 1ER;-1.679325238;48.08837771;;LOISIRS CULTURELS;;Enfants, adolescents;;Mercredis et petites vacances, les accueils de loisirs municipaux;;;;Non renseigné;;;;48.08837771, -1.679325238
977;Bibliothèque La Bellangerais;;;bibliotheque.bellangerais@ville-rennes.fr;www.bibliotheques.rennes.fr;A Rennes, 11 bibliothèques de quartier ouvertes à tous vous accueillent pour emprunter livres, magazines, DVD, CD, accéder à internet et lire ou travailler sur place.~~~Partenaire de la carte Sortir.;;Mardi et vendredi, 14h30 à 18h30. Mercredi, 10h à 12h30 et 14h30 à 18h30. Samedi, 10h à 12h30 et 14h30 à 18h.~~~;CS 63126;35031;02 23 62 26 40;;;1;Rennes;5;Maurepas - Bellangerais;5;bis;;;RUE DU MORBIHAN;-1.668173844;48.13534791;;LOISIRS CULTURELS;;Tout  public;La plupart des équipements de quartier (municipaux, associatifs) proposent, tout au long de l'année, un grand choix d'activités culturelles, régulières sous forme de stage : loisirs artistiques, audiovisuel, étude et réflexion, musique, science et nature, théâtre…;Bibliothèques municipales;11 bibliothèques ouvertes à tous vous accueillent. Pour emprunter le dernier polar, lire un album à ses enfants, visiter une exposition, choisir un DVD, se renseigner sur la culture des tomates, surfer sur le Net, réviser ses cours, demander un con-seil de lecture, lire le journal et bien d'autres chose encore…;;;Non renseigné;;;;48.13534791, -1.668173844
1165;Bibliothèque Villejean;;;bibliotheque.villejean@ville-rennes.fr;www.bibliotheques.rennes.fr;A Rennes, 11 bibliothèques de quartier ouvertes à tous vous accueillent pour emprunter livres, magazines, DVD, CD, accéder à internet et lire ou travailler sur place. Espace multimédia avec 6 accès internet.~~~Partenaire de la carte Sortir.;Ressources disponibles en auto-formation : alphabétisation, français langue étrangère (FLE), français seconde langue (FSL), presse internationale, autres supports (dictionnaires, grammaires, manuels d’apprentissage de la langue, livres en français facile, méthodes...).;Mardi et vendredi, 14h30 à 18h30. Mercredi, 10h à 12h30 et 14h30 à 18h30. Samedi, 10h à 12h30 et 14h30 à 18h.~~~;CS 63126;35031;02 23 62 26 32;;;1;Rennes;10;Villejean - Beauregard;43;;;COURS PRESIDENT JOHN FITZGERALD KENNEDY;COURS PRESIDENT JOHN FITZGERALD KENNEDY;-1.710860127;48.12095368;;LOISIRS CULTURELS;;Tout  public;La plupart des équipements de quartier (municipaux, associatifs) proposent, tout au long de l'année, un grand choix d'activités culturelles, régulières sous forme de stage : loisirs artistiques, audiovisuel, étude et réflexion, musique, science et nature, théâtre…;Bibliothèques municipales;11 bibliothèques ouvertes à tous vous accueillent. Pour emprunter le dernier polar, lire un album à ses enfants, visiter une exposition, choisir un DVD, se renseigner sur la culture des tomates, surfer sur le Net, réviser ses cours, demander un con-seil de lecture, lire le journal et bien d'autres chose encore…;;;handicap auditif : bonne accessibilité;handicap cognitif : bonne accessibilité;handicap moteur : bonne accessibilité;handicap visuel : bonne accessibilité;48.12095368, -1.710860127
