ID;Nom;Sigle;Minitel;Email;Web;Description;Info;Horaires;BP;CP;Telephone1;Telephone2;Fax;CommuneID;CommuneNom;QuarNum;QuarNom;AdreNumero;AdreExtension;AdreImmeuble;AdreRue1;AdreRue2;Longitude;Latitude;OrgaDescription;DomaineLibelle1;DomaineDescription1;DomaineLibelle2;DomaineDescription2;DomaineLibelle3;DomaineDescription3;DomaineLibelle4;DomaineDescription4;Accessibilité 1;Accessibilité 2;Accessibilité 3;Accessibilité 4;Geo
231;Ferme de la Harpe Centre Léo Lagrange;;;;www.laharpe.net;Equipement socio-culturel : activités techniques, musicales, audiovisuelles, artistiques et sportives. Partenaire de la carte Sortir.;Un hébergement de 21 lits, équipé d'une cuisine, est disponible pour l’accueil de groupes, en semaine et le week-end.;Lundi, 14h à 18h30. Mardi au vendredi, 9h à 12h et 14h à 18h30. Fermée l'été et pendant les vacances scolaires et le mois d'août.;;35000;02 99 59 45 38;;02 99 54 43 27;1;Rennes;10;Villejean - Beauregard;;;;AVENUE CHARLES TILLON;AVENUE CHARLES TILLON;-1.707592275;48.1261086;Equipement socio-culturel : activités techniques, musicales, audiovisuelles, artistiques et sportives. Promotion des pratiques techniques (mécanique, métallerie, forge, menuiserie...) et musicales (jazz, club jazz le jeudi soir...) Partenaire de la carte Sortir.;LOISIRS CULTURELS;;Tout  public;La plupart des équipements de quartier (municipaux, associatifs) proposent, tout au long de l'année, un grand choix d'activités culturelles, régulières sous forme de stage : loisirs artistiques, audiovisuel, étude et réflexion, musique, science et nature, théâtre…;Les équipements de quartier qui proposent des activités régulières;;;;Non renseigné;;;;48.1261086, -1.707592275
797;Centre social Ty-Blosne;CS;;cs.ty-blosne@assoarcs.com;www.centres-sociaux-rennais.fr;Equipement de proximité à la disposition des habitants : accueil, information sociale, aide à la fonction parentale et à la vie quotidienne. Il favorise le lien social et la solidarité entre les habitants à travers des animations spécifiques, et le soutien aux initiatives des habitants et associations visant à une vie de quartier plus conviviale. Partenaire de la carte Sortir.;Groupe Parlons Français : compréhension et expression. Atelier sensibilisation au monde professionnel en France. Accompagnement scolaire collectif du CP au CM2. Halte-garderie ouverte pour les enfants de 3 mois à 3 ans, espaces parents et enfants autour du jeu et d’activités d’éveil. Accueil de loisirs pour les 3 ans à 11 ans, mercredi et pendant les vacances scolaires.;Lundi au vendredi, 9h à 12h15 et 13h45 à 18h (sauf vendredi : 17h30). Fermé mardi matin. Accueil de loisirs pour les 3 ans à 11 ans mercredi, 13h30 à 17h30 et pendant les vacances scolaires.;;35200;02 99 50 90 47;;02 99 41 84 39;1;Rennes;11;Le Blosne;7;;;;BOULEVARD DE YOUGOSLAVIE;-1.658399999;48.08863464;Favorise le lien social et la solidarité entre les habitants à travers des animations spécifiques, et le soutien aux initiatives des habitants et associations visant à une vie de quartier plus conviviale. Partenaire de la carte Sortir.;LOISIRS CULTURELS;;Tout  public;La plupart des équipements de quartier (municipaux, associatifs) proposent, tout au long de l'année, un grand choix d'activités culturelles, régulières sous forme de stage : loisirs artistiques, audiovisuel, étude et réflexion, musique, science et nature, théâtre…;Les équipements de quartier qui proposent des activités régulières;;;;Non renseigné;Non renseigné;;;48.08863464, -1.658399999
1314;Maison des squares;;;accueil@maisondessquares.org;www.maisondessquares.org;Equipement socio-culturel de proximité qui propose diverses activités aux enfants et familles du Blosne en s'appuyant sur les principes d'interculturalité, de diversité et d'égalité entre les femmes et les hommes. Actions de soutien à la parentalité.;Accompagnement scolaire individuel et collectif du CP à la 5e. Actions et services pour faciliter l'insertion socioprofessionnelle et l'accès à la culture (cours de français, atelier CV, accès internet). Centre de loisirs associatifs pour les 5-12 ans, mercredi, 14h à 18h. Lieu : 1 place du Banat.;Lundi au vendredi, 9h à 12h et 14h à 18h. Fermée mardi matin.;;35200;02 99 51 03 93;;09 57 68 32 96;1;Rennes;11;Le Blosne;23;bis;;;PLACE DE SERBIE;-1.658751789;48.08800888;Equipement socio-culturel de proximité qui propose diverses activités aux enfants et familles du Blosne en s'appuyant sur les principes d'interculturalité, de diversité et d'égalité entre les femmes et les hommes.;LOISIRS CULTURELS;;Tout  public;La plupart des équipements de quartier (municipaux, associatifs) proposent, tout au long de l'année, un grand choix d'activités culturelles, régulières sous forme de stage : loisirs artistiques, audiovisuel, étude et réflexion, musique, science et nature, théâtre…;Les équipements de quartier qui proposent des activités régulières;;;;handicap auditif : bonne accessibilité;handicap cognitif : bonne accessibilité;handicap moteur : faible accessibilité;handicap visuel : bonne accessibilité;48.08800888, -1.658751789
2836;Pôle associatif Landrel;;;v.binet@apras.asso.fr;www.apras.org;Espace occupé par des associations et collectifs d’habitants qui partagent des locaux et des moyens de fonctionnement pour développer leurs activités et des actions collectives dans le quartier. L'Association pour la promotion de l’action et de l’animation sociale (Apras) accompagne l'animation de ces pôles et les associations hébergées pour l'élaboration d'un projet commun, visant au développement d'actions et de dynamiques collectives sur le quartier.;Les associations / collectifs hébergées : l’AJPS, Elektron, le Secours Catholique, Collectif Intermède, Avenir, Les Amis de Rennes, Espace et Lumière.;Ouvert tous les jours de la semaine, en fonction des activités ou des évènements proposés.;;35000;02 99 31 52 44;;02 99 30 81 17;1;Rennes;11;Le Blosne;15;;;Place du Landrel;;-1.652203733;48.09077713;;LOISIRS CULTURELS;;Tout  public;La plupart des équipements de quartier (municipaux, associatifs) proposent, tout au long de l'année, un grand choix d'activités culturelles, régulières sous forme de stage : loisirs artistiques, audiovisuel, étude et réflexion, musique, science et nature, théâtre…;Les équipements de quartier qui proposent des activités régulières;;;;Non renseigné;;;;48.09077713, -1.652203733
23;Cercle Paul Bert Bréquigny;CPB;;brequigny@cerclepaulbert.asso.fr;www.cerclepaulbert.asso.fr;Association affiliée à la Ligue Française de l’Enseignement.~~~Ses équipements proposent des disciplines très diverses.~~~;;Lundi, mercredi, jeudi, 13h30 à 18h. Mardi et vendredi,  8h30 à 12h et 13h30 à 18h. Samedi, 9h à 12h.;;35200;02 99 31 71 17;;02 99 30 35 85;1;Rennes;12;Bréquigny;10;;;BOULEVARD ALBERT 1ER;BOULEVARD ALBERT 1ER;-1.688306155;48.08946294;;LOISIRS CULTURELS;;Tout  public;La plupart des équipements de quartier (municipaux, associatifs) proposent, tout au long de l'année, un grand choix d'activités culturelles, régulières sous forme de stage : loisirs artistiques, audiovisuel, étude et réflexion, musique, science et nature, théâtre…;Les équipements de quartier qui proposent des activités régulières;;;;Non renseigné;;;;48.08946294, -1.688306155
2510;L'Hexagone;;;hexagonerennes@free.fr;hexagonerennes.free.fr;Gérée par l'association Hexagone, cette salle accueille activités sportives, culturelles et de loisirs.;;La salle peut être louée le week-end et est disponible lundi après-midi et mercredi.;;35200;02 99 32 47 98;02 99 53 21 30;;1;Rennes;12;Bréquigny;34;b;;;RUE FREDERIC LE GUYADER;-1.699049352;48.08610992;;LOISIRS CULTURELS;;Tout  public;La plupart des équipements de quartier (municipaux, associatifs) proposent, tout au long de l'année, un grand choix d'activités culturelles, régulières sous forme de stage : loisirs artistiques, audiovisuel, étude et réflexion, musique, science et nature, théâtre…;Les équipements de quartier qui proposent des activités régulières;;;;Non renseigné;;;;48.08610992, -1.699049352
933;Pôle multimédia Maurepas;;;leslongspres@free.fr;www.leslongspres.fr;Activités proposées : jeux en réseau, initiation bureautique, internet, musique assistée par ordinateur, imprimante 3D.;Se situe dans le pôle associatif de la Marbaudais.;;;35700;02 99 38 43 86;;;1;Rennes;5;Maurepas - Bellangerais;32;;;;RUE DE LA MARBAUDAIS;-1.662556515;48.1265965;;LOISIRS CULTURELS;;Tout  public;La plupart des équipements de quartier (municipaux, associatifs) proposent, tout au long de l'année, un grand choix d'activités culturelles, régulières sous forme de stage : loisirs artistiques, audiovisuel, étude et réflexion, musique, science et nature, théâtre…;Les pôles multimédia;La Ville de Rennes et les équipements de quartier proposent de découvrir le multimédia et ses usages. Des animateurs accueillent, orientent et accompagnent tous les publics. En 2014, 11 imprimantes 3D et des kits de prototypage électronique complètent les installations.;;;Non renseigné;;;;48.1265965, -1.662556515
755;Pôle multimédia Association Les Trois Maisons;;;pnt.3maisons@gmail.com;www.troismaisons.org;La Ville de Rennes et les équipements de quartiers proposent de découvrir le multimédia et ses usages : plate-forme de services emploi, formation, droit, créativité, communication, apprentissage, hébergement, adresses mails.... autant de sujets abordés lors d'ateliers organisés ou en séances d'accès libre.~~~Activités proposées : initiation internet, bureautique, traitement de l'image, création de blog.;Participation et démonstrations au Repair Café (atelier de réparation) des Trois Maisons le deuxième mardi du mois.;Lundi, 14h à 16h. Mardi, 14h à 19h. Mercredi, 9h30 à 12h30. Jeudi, 9h30 à 12h30 et 14h à 16h. Vendredi, 14h à 19h.;;35000;02 23 42 07 96;;;1;Rennes;9;Cleunay - Arsenal - Redon - La Courrouze;10;;;ALLEE MARION DU FAOUET;ALLEE MARION DU FAOUET;-1.696030958;48.10675014;;LOISIRS CULTURELS;;Tout  public;La plupart des équipements de quartier (municipaux, associatifs) proposent, tout au long de l'année, un grand choix d'activités culturelles, régulières sous forme de stage : loisirs artistiques, audiovisuel, étude et réflexion, musique, science et nature, théâtre…;Les pôles multimédia;La Ville de Rennes et les équipements de quartier proposent de découvrir le multimédia et ses usages. Des animateurs accueillent, orientent et accompagnent tous les publics. En 2014, 11 imprimantes 3D et des kits de prototypage électronique complètent les installations.;;;Non renseigné;;;;48.10675014, -1.696030958
1016;Théâtre La Paillette;;;billetterie@la-paillette.net;www.la-paillette.net;Lieu de travail, de création, d’expérimentation et de dialogue avec les artistes et le public autour de l’esthétique du théâtre. Partenaire de la carte sortir.;;Accueil du public, mardi au vendredi, 13h à 17h30. Ouverture 1h avant chaque représentation.;;35000;02 99 59 88 86;;02 99 59 88 88;1;Rennes;3;Bourg-L'Evêque - La Touche - Moulin du Comte;6;;;;RUE LOUIS GUILLOUX;-1.697207288;48.10925193;;LOISIRS CULTURELS;;Tout  public;La plupart des équipements de quartier (municipaux, associatifs) proposent, tout au long de l'année, un grand choix d'activités culturelles, régulières sous forme de stage : loisirs artistiques, audiovisuel, étude et réflexion, musique, science et nature, théâtre…;Les structures de développement artistique;;;;handicap auditif : bonne accessibilité;handicap cognitif : bonne accessibilité;handicap moteur : bonne accessibilité;handicap visuel : bonne accessibilité;48.10925193, -1.697207288
1640;Cercle Paul Bert - Le Noroît;CPB;;noroit@cerclepaulbert.asso.fr;www.cpbnoroit.fr;Equipement de quartier, activités sportives et culturelles pour tous.;Accueil de loisirs : pour les 5-11 ans et 12-17 ans. Ateliers structurés, activités et sorties, accueil informel.;Lundi, 9h à 12h et 14h à 17h. Mardi et mercredi, 9h à 12h et 14h à 18h. Jeudi, 9h00 à 12h et 14h à 18h30. Vendredi, 14h00 à 17h. Fermé les 3 premières semaines d'août et à Noël.;;35000;02 23 46 10 40;;02 99 54 89 07;1;Rennes;3;Bourg-L'Evêque - La Touche - Moulin du Comte;28;;;;RUE CHARLES GENIAUX;-1.711073888;48.11078869;Accueil de loisirs : pour les 9-18 ans. Un projet passerelle concerne les 9-13 ans, avec des ateliers structurés, activités et sorties.;LOISIRS CULTURELS;;Enfants, adolescents;;Les accueils de loisirs associatifs;;;;Non renseigné;;;;48.11078869, -1.711073888
980;Maison de quartier La Bellangerais;;;contact@labellangerais.org;www.labellangerais.org;Affilié à la fédération Léo Lagrange, l'équipement de quartier, conventionné avec la Ville de Rennes, propose des activités et événements pour les enfants, jeunes, adultes, familles, associations, groupes autoconstitués. Participation à des événements locaux : quartiers d'été, transmusicales, Comptoir du doc, les P'tits Bouquineurs, festival Marmaille...~~~;Centre de loisirs associatifs pour les 4-12 ans, mercredi, 13h30 à 18h30, et du lundi au vendredi sur les vacances scolaires.~~~Accueil de loisirs jeunesse pour les 10-17 ans, mardi, jeudi vendredi 17h-19h, mercredi 14h-18h et programme d'activités sur les vacances scolaires du lundi au vendredi.~~~Eté 2016 : Accueil de loisirs (10-18ans), lundi au vendredi, 14h à 18h .Activités thématiques sur inscription.Fermée du 1er au 19 août~~~inclus.~~~;Période scolaire : lundi, 14h à 18h. Mardi, 10h à 12h et 14h à 19h. Mercredi, 10h à 12h30 et 13h30 à 19h. Jeudi, 14h à 19h. Vendredi, 10h à 12h et 14h à 18h.~~~Pendant les vacances scolaires : lundi et jeudi, 14h à 18h. Mardi, mercredi et vendredi, 10h à 12h et 14h à 18h. Ouvert été 2016 sauf du 1er au 19 août.~~~;;35700;02 99 27 21 10;;;1;Rennes;5;Maurepas - Bellangerais;5;;;RUE DU MORBIHAN;RUE DU MORBIHAN;-1.668202553;48.13557106;Centre de loisirs associatifs pour les 4-12 ans, mercredi, 13h30 à 18h30.;LOISIRS CULTURELS;;Enfants, adolescents;;Les accueils de loisirs associatifs;;;;Non renseigné;;;;48.13557106, -1.668202553
747;Centre social Cleunay;CS;;cs.cleunay@assoarcs.com;www.centres-sociaux-rennais.fr;Equipement de proximité à la disposition des habitants : accueil, information sociale, aide à la fonction parentale et à la vie quotidienne. Il favorise le lien social et la solidarité entre les habitants à travers des animations spécifiques, et le soutien aux initiatives des habitants et associations visant à une vie de quartier plus conviviale.~~~Partenaire de la carte Sortir.;Halte garderie pour les 3 mois à 3 ans. Accueil de loisirs pour les enfants de 3 à 6 ans. Lieu d’accueil enfants parents (3 à 6 ans).~~~Activités adultes et familles : bourses, ludothèque pour tout public, ateliers cuisine, jardin et  couture, sorties  culturelles, expositions, après midi jeux, prêt de salles et de matériel...~~~Dispose également d'un espace ressources emploi(ERE).Il reçoit tous les habitants inscrits ou non au Pôle emploi en recherche d'un emploi ou d'une formation.Il propose  un premier niveau d'information et de documentation, en orientant les personnes vers les interlocuteurs ressources.;Lundi au vendredi, 9h à 12h et 13h45 à 18h. Fermé mardi matin.~~~Accueil de loisirs mercredi et vacances scolaires, pour les enfants de 3 à 6 ans.;;35000;02 99 67 32 14;;02 99 31 27 33;1;Rennes;9;Cleunay - Arsenal - Redon - La Courrouze;49;;;;RUE JULES LALLEMAND;-1.707962366;48.10003505;Accueil de loisirs le mercredi et vacances scolaires, pour les enfants de 3 à 6 ans.;LOISIRS CULTURELS;;Enfants, adolescents;;Les accueils de loisirs associatifs;;;;Non renseigné;;;;48.10003505, -1.707962366
428;Cercle Paul Bert Cleunay;CPB;;cleunay@cerclepaulbert.asso.fr;www.cerclepaulbert.asso.fr;Association affiliée à la Ligue Française de l’Enseignement.~~~Ses équipements proposent des disciplines sportives et culturelles très diverses. Organise des mini camps à Trémelin et des événements socio sportifs dans les quartiers.~~~Activités en lien avec le projet de la structure. Sorties à la demi-journée ou à la journée (plage à Saint-Malo...).~~~Stages sportifs : rollers, skate, trottinettes, athlétisme, boxe…~~~;Centre de loisirs et accompagnement scolaire individualisé en collectif du CP à la 3e.~~~Centre de loisirs associatifs pour les 6-11 ans, mercredi, 9h à;Lundi, 9h à 12h. Mardi, 14h à 18h. Mercredi, 9h à 12h et  14h à 18h. Jeudi, 14h à 17h. Vendredi, 9h à 12h et 14h à 17h.~~~Centre de loisirs associatifs pour les 6-11 ans, mercredi, 9h à 18h.;;35000;02 99 67 23 36;;;1;Rennes;9;Cleunay - Arsenal - Redon - La Courrouze;2;;;BOULEVARD DE LA GUERINAIS;BOULEVARD DE LA GUERINAIS;-1.705265684;48.09869713;Centre de loisirs associatifs pour les 6-11 ans le mercredi de 9h à 18h.;LOISIRS CULTURELS;;Enfants, adolescents;;Les accueils de loisirs associatifs;;;;Non renseigné;;;;48.09869713, -1.705265684
1314;Maison des squares;;;accueil@maisondessquares.org;www.maisondessquares.org;Equipement socio-culturel de proximité qui propose diverses activités aux enfants et familles du Blosne en s'appuyant sur les principes d'interculturalité, de diversité et d'égalité entre les femmes et les hommes. Actions de soutien à la parentalité.;Accompagnement scolaire individuel et collectif du CP à la 5e. Actions et services pour faciliter l'insertion socioprofessionnelle et l'accès à la culture (cours de français, atelier CV, accès internet). Centre de loisirs associatifs pour les 5-12 ans, mercredi, 14h à 18h. Lieu : 1 place du Banat.;Lundi au vendredi, 9h à 12h et 14h à 18h. Fermée mardi matin.;;35200;02 99 51 03 93;;09 57 68 32 96;1;Rennes;11;Le Blosne;23;bis;;;PLACE DE SERBIE;-1.658751789;48.08800888;Centre de loisirs associatifs pour les 5-12 ans le mercredi de 14h à 18h. Lieu : 1 place du Banat.;LOISIRS CULTURELS;;Enfants, adolescents;;Les accueils de loisirs associatifs;;;;handicap auditif : bonne accessibilité;handicap cognitif : bonne accessibilité;handicap moteur : faible accessibilité;handicap visuel : bonne accessibilité;48.08800888, -1.658751789
797;Centre social Ty-Blosne;CS;;cs.ty-blosne@assoarcs.com;www.centres-sociaux-rennais.fr;Equipement de proximité à la disposition des habitants : accueil, information sociale, aide à la fonction parentale et à la vie quotidienne. Il favorise le lien social et la solidarité entre les habitants à travers des animations spécifiques, et le soutien aux initiatives des habitants et associations visant à une vie de quartier plus conviviale. Partenaire de la carte Sortir.;Groupe Parlons Français : compréhension et expression. Atelier sensibilisation au monde professionnel en France. Accompagnement scolaire collectif du CP au CM2. Halte-garderie ouverte pour les enfants de 3 mois à 3 ans, espaces parents et enfants autour du jeu et d’activités d’éveil. Accueil de loisirs pour les 3 ans à 11 ans, mercredi et pendant les vacances scolaires.;Lundi au vendredi, 9h à 12h15 et 13h45 à 18h (sauf vendredi : 17h30). Fermé mardi matin. Accueil de loisirs pour les 3 ans à 11 ans mercredi, 13h30 à 17h30 et pendant les vacances scolaires.;;35200;02 99 50 90 47;;02 99 41 84 39;1;Rennes;11;Le Blosne;7;;;;BOULEVARD DE YOUGOSLAVIE;-1.658399999;48.08863464;Accueil de loisirs pour les 3 ans à 11 ans mercredi, 13h30 à 17h30 et pendant les vacances scolaires.;LOISIRS CULTURELS;;Enfants, adolescents;;Les accueils de loisirs associatifs;;;;Non renseigné;Non renseigné;;;48.08863464, -1.658399999
1466;Centre de loisirs Pluriel;;;rennes@loisirs-pluriel.com;www.loisirs-pluriel.com;Centre de loisirs pour enfants handicapés et valides de Rennes et alentours, de 3 à 13 ans. Lieu d'accueil  : école Oscar Leroux.;Centre de loisirs associatifs pour les 3-13 ans, mercredi, 12h à 18h30.;Mercredis scolaires, 12h30 à 18h30 et pendant les vacances scolaires, 8h à 18h30. Ouvert été 2016;;35200;02 23 35 48 33;06 70 47 98 43;;1;Rennes;8;Sud-Gare;8;;;;BOULEVARD OSCAR LEROUX;-1.669648698;48.0911764;;LOISIRS CULTURELS;;Enfants, adolescents;;Les centres d'accueil pour enfants handicapés;;;;Non renseigné;;;;48.0911764, -1.669648698
861;Accueil de loisirs Moulin du Comte;;;;www.educarennes.fr/index.php/public/default/ecoles?ville=2;Propose un accueil le mercredi après-midi.~~~Les enfants sont encadrés par des responsables éducation et loisirs, des animateurs, des agents spécialisés des écoles maternelles.~~~;;Mercredi, 12h15 à 18h45. ~~~Renseignements possibles au 02 23 62 16 50.~~~;;35000;02 99 33 94 41;;;1;Rennes;3;Bourg-L'Evêque - La Touche - Moulin du Comte;103;;;;RUE DE LORIENT;-1.710418327;48.10866316;;LOISIRS CULTURELS;;Enfants, adolescents;;Mercredis et petites vacances, les accueils de loisirs municipaux;;;;Non renseigné;;;;48.10866316, -1.710418327
1393;Accueil de loisirs de l'Ille;;;;www.educarennes.fr/index.php/public/default/ecoles?ville=2;Propose un accueil le mercredi après-midi.~~~Pendant les petites vacances,les enfants de petite section au CP y sont accueillis, tandis que les enfants du CE1 au CM2 sont emmenés en car vers les centres de La Prévalaye et de Dominique Savio (centre de départ). ~~~L'été, c'est un centre de départ vers  Savio, Les Gayeulles.~~~Les enfants sont encadrés par des responsables éducation et loisirs, des animateurs, des agents spécialisés des écoles maternelles.~~~;;Mercredi, 12h15 à 18h45, petites vacances, 7h30 à 18h45. ~~~Renseignements possibles au 02 23 62 16 50.~~~;;35000;02 99 33 94 96;;;1;Rennes;3;Bourg-L'Evêque - La Touche - Moulin du Comte;24;;;Boulevard de Verdun;;-1.6923738569;48.1144839251;;LOISIRS CULTURELS;;Enfants, adolescents;;Mercredis et petites vacances, les accueils de loisirs municipaux;;;;Non renseigné;;;;48.1144839251, -1.6923738569
2959;Accueil de loisirs des Gayeulles;;;;;Nouvel équipement pour les enfants du CE1 au CM2 situé sans le parc ds loisirs des Gayeulles. De nombreuses activités sont proposées : jeux de plein air, activités physiques et sportives, sorties à la journée : accrobranche, mer et animations à thème.~~~L'été, le centre accueille les enfants du CE1 au CM2~~~Un transport en car est possible à partir des centres de départ de quartier.;;Centre ouvert du 6 juillet au 27 août.~~~Accueil sur les centres de départ de quartier à partir de 7h45 l'été.  Départ à 9h, retour vers 18h. Accueil jusqu'à 18h30 l'été;;35000;02 23 62 16 64;;;1;Rennes;5;Maurepas - Bellangerais;6;;;Rue Pierre Nougaro;;-1.6410460062;48.1395708206;;LOISIRS CULTURELS;;Enfants, adolescents;;Mercredis et petites vacances, les accueils de loisirs municipaux;;;;;;;;48.1395708206, -1.6410460062
2730;Accueil de loisirs Châteaugiron- Le Landry;;;;www.educarennes.fr/index.php/public/default/ecoles?ville=2;Propose un accueil le mercredi après-midi.~~~Les enfants sont encadrés par des responsables éducation et loisirs, des animateurs, des agents spécialisés des écoles maternelles.~~~;;Mercredi, 12h15 à 18h45. ~~~Renseignements possibles au 02 23 62 15 92.~~~;;35000;02 99 50 30 01;;;1;Rennes;7;Francisco-Ferrer - Landry - Poterie;111;bis;;;RUE DE CHATEAUGIRON;-1.646407052;48.09990329;;LOISIRS CULTURELS;;Enfants, adolescents;;Mercredis et petites vacances, les accueils de loisirs municipaux;;;;Non renseigné;;;;48.09990329, -1.646407052
216;Accueil de loisirs Champion de Cicé;;;;www.educarennes.fr/index.php/public/default/ecoles?ville=2;Propose un accueil le mercredi après-midi.~~~Pendant les petites vacances, les enfants de petite section au CP y sont accueillis, tandis que les enfants du CE1 au CM2 sont emmenés en car vers les centres de La Prévalaye (centre de départ) et de Dominique Savio.~~~L'été, les enfants de petite section sont accueillis dans ce centre. C'est aussi centre de départ vers La Prévalaye et les Gayeulles.~~~Les enfants sont encadrés par des responsables éducation et loisirs, des animateurs, des agents spécialisés des écoles maternelles.~~~;;Mercredi, 12h15 à 18h45. Petites vacances, 7h30 à 18h45. L'été du lundi au vendredi, 7h45 à 18h30. ~~~Renseignements possibles au 02 23 62 16 50.~~~;;35000;02 99 30 29 56;;;1;Rennes;9;Cleunay - Arsenal - Redon - La Courrouze;44;;;;RUE CHAMPION DE CICE;-1.705441849;48.10231606;;LOISIRS CULTURELS;;Enfants, adolescents;;Mercredis et petites vacances, les accueils de loisirs municipaux;;;;Non renseigné;;;;48.10231606, -1.705441849
723;Accueil de loisirs Jean Moulin;;;;www.educarennes.fr/index.php/public/default/ecoles?ville=2;Propose un accueil le mercredi après-midi.~~~Les enfants sont encadrés par des responsables éducation et loisirs, des animateurs, des agents spécialisés des écoles maternelles.~~~;;Mercredi, 12h15 à 18h45. ~~~Renseignements possibles au 02 23 62 16 53.~~~Pour plus d'informations : consulter le guide des activités péri et extra-scolaires et le guide de l'été. ~~~;;35000;02 99 33 79 09;;;1;Rennes;10;Villejean - Beauregard;5;;;;RUE JEAN MOULIN;-1.706408143;48.11848951;;LOISIRS CULTURELS;;Enfants, adolescents;;Mercredis et petites vacances, les accueils de loisirs municipaux;;;;Non renseigné;;;;48.11848951, -1.706408143
